{"case_id":"case_01M00JDK8JHWQ5MMDN1JTE5MZR","cells":{"C":{"control_pass_rate":1.0,"n_probes":5,"n_trials":15,"recovery_rate":0.0},"G":{"control_pass_rate":1.0,"n_probes":5,"n_trials":15,"recovery_rate":1.0},"RK":{"control_pass_rate":1.0,"n_probes":5,"n_trials":15,"recovery_rate":0.0},"RM":{"control_pass_rate":1.0,"n_probes":5,"n_trials":15,"recovery_rate":0.0},"RP":{"control_pass_rate":1.0,"n_probes":5,"n_trials":15,"recovery_rate":1.0}},"deltas":{"kb":{"ci95_lower":-0.2039,"ci95_upper":0.2039,"estimate":0.0},"method":"newcombe_wilson_diff","model_params":{"ci95_lower":-0.2039,"ci95_upper":0.2039,"estimate":0.0},"prompt":{"ci95_lower":0.7117,"ci95_upper":1.0,"estimate":1.0}},"evidence_bundle_ref":{"digest":"sha256:89676d471b27d78ffb48a16f11486112fc75baa7528c6f7cfac014268b984293","uri":"file:///Users/xiejiachen/caseloop/evidence/experiments/exp_01M0159WMBWA8S0FPQF74SYDXS/evidence-bundle.json"},"experiment_id":"exp_01M0159WMBWA8S0FPQF74SYDXS","generated_at":"2026-08-14T22:30:22.590964Z","probe_set_digest":"sha256:f51fbbee2810467c96658f93e4fc2b64b5b843b80e55bf5029f30fa26bb9dbf0","report_id":"attr_948563483c8c40ce8b56","schema_version":"0.1.0","verdict":{"attributed_layer":"prompt","decision":"ATTRIBUTED","full_factorial_required":false,"interaction_detected":false,"rationale":"R4 命中：仅 RP 臂恢复显著（Δ=1.000 95%CI[0.712,1.000]，LB=0.712>δ_min=0.2），且 hidden confirmation 组同向复现（hidden Δ=1.000，LB=0.448>0）→ 故障层=prompt"},"version_digests":{"K0":"sha256:258a5e4f0d50fbb4728b82d63f45f45412589a992ca2f2bf553ab7466f0503c7","K1":"sha256:258a5e4f0d50fbb4728b82d63f45f45412589a992ca2f2bf553ab7466f0503c7","M0":"sha256:4dd5481cc1db92293181c38125df39536809155e11ec43f3f002c1373ac45a67","M1":"sha256:4dd5481cc1db92293181c38125df39536809155e11ec43f3f002c1373ac45a67","P0":"sha256:258a5e4f0d50fbb4728b82d63f45f45412589a992ca2f2bf553ab7466f0503c7","P1":"sha256:4dd5481cc1db92293181c38125df39536809155e11ec43f3f002c1373ac45a67"}}